"739f3e75-978b-4047-af0f-7c4dad6c0623","10281/9139",,,,,,,,"Goal 3: Good health and well-being::29622::600","AREA MIN. 01 - SCIENZE MATEMATICHE E INFORMATICHE||AREA MIN. 11 - SCIENZE STORICHE, FILOSOFICHE, PEDAGOGICHE, PSICOLOGICHE||AREA MIN. 01 - SCIENZE MATEMATICHE E INFORMATICHE",,,,"2025-05-29T07:20:19Z","2025-03-29","2025-05-29T07:20:19Z",,"This paper explores the use of Large Language Models (LLMs) in mental health to assist psychologists and psychiatrists with diagnostic decision-making according to the ICD-11 classification system. ICD-11 is the 11th revision of the International Classification of Diseases, a globally used diagnostic tool for health conditions, including mental, behavioural, and neurodevelopmental disorders. In detail, we propose LLMind Chat, an AI-powered tool with a user-friendly interface designed to support mental health professionals in their diagnostic processes. LLMind Chat leverages a Retrieval Augmented Generation (RAG) model based on the Gemma 2 (27B parameters), specifically adapted to the context of the ICD-11. This RAG model combines the strengths of Gemma 2 with a comprehensive knowledge base derived from the ICD-11, allowing it to access and process relevant information from the classification manual in real-time. LLMind's diagnostic accuracy was rigorously evaluated against the DSM-5-TR Clinical Cases manual, using automated metrics and mental health professionals’ expert validation. The result suggests that LLMind Chat can serve as a reliable decision-support tool, enhancing diagnostic reasoning and potentially reducing misclassifications.",,,,,,,"Cremaschi, M., Ditolve, D., Curcio, C., Panzeri, A., Spoto, A., Maurino, A. (2025). Decoding the mind: A RAG-LLM on ICD-11 for decision support in psychology. EXPERT SYSTEMS WITH APPLICATIONS, 279(15 June 2025) [10.1016/j.eswa.2025.127191].",,,,,"GB",,"Elsevier Ltd",,,,"127191",,,,,,,,,,,,,,,"Clinical decision support; Diagnostic reasoning; DSM5; Healthcare; ICD-11; Large language models; Mental health; Prompt Engineering; Psychology; Retrieval Augmented Generation;",,"Articolo in rivista - Articolo scientifico",,"Pubblicato","Scientifica",,,,,,"2025","Decoding the mind: A RAG-LLM on ICD-11 for decision support in psychology","2025/05/29 05:15:19","1748488519718",,,,"2025/05/30 03:39:59","2025/05/29 09:20:19","1748503219973","2025","Decoding the mind: A RAG-LLM on ICD-11 for decision support in psychology","2025/05/29 05:15:22","1748488522953","1","publisher","publishedVersion","10.1016/j.eswa.2025.127191",,"publisher","true","false","https://doi.org/10.1016/j.eswa.2025.127191","cc-by-nc-nd","04/02/2026 03:36:39","1770172599427","hybrid",,,"EXPERT SYSTEMS WITH APPLICATIONS###0957-4174",,,"PE||IQ||EP","University of Milano-Bicocca||University of Milano-Bicocca||University of Milano-Bicocca||University of Padua||University of Padua||University of Milano-Bicocca","Italy||Italy||Italy||Italy||Italy||Italy","Marco||Davide||Cesare||Anna||Andrea||Andrea","LPQ-1600-2024||MYU-6144-2025||MYZ-1657-2025||AAC-8386-2019||LGC-8800-2024||FMK-8474-2022","Dept Gen Psychol||Dept Gen Psychol","Cremaschi||Ditolve||Curcio||Panzeri||Spoto||Maurino","2025","This paper explores the use of Large Language Models (LLMs) in mental health to assist psychologists and psychiatrists with diagnostic decision-making according to the ICD-11 classification system. ICD-11 is the 11th revision of the International Classification of Diseases, a globally used diagnostic tool for health conditions, including mental, behavioural, and neurodevelopmental disorders. In detail, we propose LLMind Chat, an AIpowered tool with a user-friendly interface designed to support mental health professionals in their diagnostic processes. LLMind Chat leverages a Retrieval Augmented Generation (RAG) model based on the Gemma 2 (27B parameters), specifically adapted to the context of the ICD-11. This RAG model combines the strengths of Gemma 2 with a comprehensive knowledge base derived from the ICD-11, allowing it to access and process relevant information from the classification manual in real-time. LLMind's diagnostic accuracy was rigorously evaluated against the DSM-5-TR Clinical Cases manual, using automated metrics and mental health professionals' expert validation. The result suggests that LLMind Chat can serve as a reliable decision-support tool, enhancing diagnostic reasoning and potentially reducing misclassifications.","Cremaschi, M; Ditolve, D; Curcio, C; Panzeri, A; Spoto, A; Maurino, A;","WOS.SCI","Article","Articolo in rivista - Articolo scientifico","Article","10.1016/j.eswa.2025.127191","1873-6793","WOS:001465047300001","EXPERT SYSTEMS WITH APPLICATIONS","EXPERT SYST APPL","English","THE BOULEVARD, LANGFORD LANE, KIDLINGTON, OXFORD OX5 1GB, ENGLAND",,,,"279","Decoding the mind: A RAG-LLM on ICD-11 for decision support in psychology","EXPERT SYSTEMS WITH APPLICATIONS###0957-4174",,"2200||1706||1702","University of Milano-Bicocca||University of Milano-Bicocca||University of Milano-Bicocca||University of Padua||University of Padua||University of Milano-Bicocca","60012306||60012306||60012306||60000481||60000481||60012306","56167172000||59722998400||59722392300||57208593406||23398508300||22433645700","Italy||Italy||Italy||Italy||Italy||Italy","103061402||103061402","Marco||Davide||Cesare||Anna||Andrea||Andrea","Department of General Psychology;||Department of General Psychology;","Cremaschi||Ditolve||Curcio||Panzeri||Spoto||Maurino","2025","This paper explores the use of Large Language Models (LLMs) in mental health to assist psychologists and psychiatrists with diagnostic decision-making according to the ICD-11 classification system. ICD-11 is the 11th revision of the International Classification of Diseases, a globally used diagnostic tool for health conditions, including mental, behavioural, and neurodevelopmental disorders. In detail, we propose LLMind Chat, an AI-powered tool with a user-friendly interface designed to support mental health professionals in their diagnostic processes. LLMind Chat leverages a Retrieval Augmented Generation (RAG) model based on the Gemma 2 (27B parameters), specifically adapted to the context of the ICD-11. This RAG model combines the strengths of Gemma 2 with a comprehensive knowledge base derived from the ICD-11, allowing it to access and process relevant information from the classification manual in real-time. LLMind's diagnostic accuracy was rigorously evaluated against the DSM-5-TR Clinical Cases manual, using automated metrics and mental health professionals’ expert validation. The result suggests that LLMind Chat can serve as a reliable decision-support tool, enhancing diagnostic reasoning and potentially reducing misclassifications.","Cremaschi M.; Ditolve D.; Curcio C.; Panzeri A.; Spoto A.; Maurino A.","scopus.description.allpeopleoriginal","ar","ar",,,"10.1016/j.eswa.2025.127191",,,"2038209319","2-s2.0-105001855362","24201","eng","Elsevier Ltd","127191",,,,,,,"279","Clinical decision support; Diagnostic reasoning; DSM5; Healthcare; ICD-11; Large language models; Mental health; Prompt Engineering; Psychology; Retrieval Augmented Generation;","Decoding the mind: A RAG-LLM on ICD-11 for decision support in psychology","Decoding the mind: A RAG-LLM on ICD-11 for decision support in psychology"
"e86bdbda-67db-4301-898c-d6271c0554c0","10281/9140",,,,"CEUR WORKSHOP PROCEEDINGS::journal39240::600",,,,"Goal 9: Industry, Innovation, and Infrastructure::29628::600","AREA MIN. 01 - SCIENZE MATEMATICHE E INFORMATICHE||AREA MIN. 01 - SCIENZE MATEMATICHE E INFORMATICHE",,,,"2024-03-08T18:06:46Z",,"2024-03-08T18:06:46Z",,"Understanding users’ reading behaviour can facilitate and support the development of data lexicalisation models based on users’ characteristics. A significant amount of data can be found online in tabular form, and several models have been developed to provide the user with summaries of the content of such tables. Nevertheless, studies analysing table reading patterns are almost entirely lacking in the literature, making it almost impossible to integrate findings on user reading behaviour into lexicalisation models. This work aims to suggest a new line of gaze-related research that can integrate insights about user behaviour and characteristics into data summarisation algorithms to provide textual content that meets the user’s information needs. An overview of human-gaze studies applied to natural language will be presented to outline a study on human interaction with tables. Potential fields of application and challenges in applying these results to the field of table summarisation, namely the task of producing short summaries of tabular data, from a user-centred perspective will be discussed.",,,,,,,"Amianto Barbato, J., Cremaschi, M. (2022). Bridging the gap between human-gaze data and table summarisation. In Proceedings of the 1st Workshop on Artificial Intelligence for Human Machine Interaction 2022
co-located with the 21st International Conference of the Italian Association for Artificial Intelligence (AIxIA 2022) (pp.1-8). CEUR-WS.",,,,,,,"CEUR-WS",,,"Saibene, A; Corchs, S; Solé-Casals, J",,"2022",,"1st Workshop on Artificial Intelligence for Human Machine Interaction, AIxHMI 2022","1",,"Udine, Italy","Proceedings of the 1st Workshop on Artificial Intelligence for Human Machine Interaction 2022
co-located with the 21st International Conference of the Italian Association for Artificial Intelligence (AIxIA 2022)",,,,,,,,"data summarisation; eye-tracking studies; human intepretation; human-gaze data; lexicalisation; table summarisation;",,"paper","contributo",,"Scientifica",,,,,,,,,,,,,,"2024/03/08 19:06:46","1709921206335","2022","Bridging the gap between human-gaze data and table summarisation",,,"1",,,,,,,,,,,,,,,,,,,,,,,,,,,,,,,,,,,,,,,,,,,,,"CEUR WORKSHOP PROCEEDINGS###1613-0073","1700","University of Milan - Bicocca||University of Milan - Bicocca","60012306||60012306","58193325900||56167172000","Italy||Italy","","Jessica Amianto||Marco","","Barbato||Cremaschi","2022","Understanding users’ reading behaviour can facilitate and support the development of data lexicalisation models based on users’ characteristics. A significant amount of data can be found online in tabular form, and several models have been developed to provide the user with summaries of the content of such tables. Nevertheless, studies analysing table reading patterns are almost entirely lacking in the literature, making it almost impossible to integrate findings on user reading behaviour into lexicalisation models. This work aims to suggest a new line of gaze-related research that can integrate insights about user behaviour and characteristics into data summarisation algorithms to provide textual content that meets the user’s information needs. An overview of human-gaze studies applied to natural language will be presented to outline a study on human interaction with tables. Potential fields of application and challenges in applying these results to the field of table summarisation, namely the task of producing short summaries of tabular data, from a user-centred perspective will be discussed.","Barbato J.A.; Cremaschi M.","scopus.description.allpeopleoriginal||scopus.relation.conferenceplace","cp","cp",,,,,,"641094671","2-s2.0-85153385057","21100218356","eng","CEUR-WS",,"2022","1st Workshop on Artificial Intelligence for Human Machine Interaction, AIxHMI 2022","ita","1",,"8","3368","data summarisation; eye-tracking studies; human intepretation; human-gaze data; lexicalisation; table summarisation;","Bridging the gap between human-gaze data and table summarisation","Bridging the gap between human-gaze data and table summarisation"
"e39773c6-6eb6-35a3-e053-3a05fe0aac26","10281/9140",,,,"LECTURE NOTES IN COMPUTER SCIENCE::journal40095::600",,,,"Not applicable::31921::600","AREA MIN. 01 - SCIENZE MATEMATICHE E INFORMATICHE||AREA MIN. 09 - INGEGNERIA INDUSTRIALE E DELL’INFORMAZIONE",,,,"2022-02-02T05:29:43Z","2021-09-30","2022-02-02T05:29:43Z",,"Much information is conveyed within tables, which can be semantically annotated by humans or (semi)automatic approaches. Nevertheless, many applications cannot take full advantage of semantic annotations because of the low quality. A few methodologies exist for the quality assessment of semantic annotation of tabular data, but they do not automatically assess the quality as a multidimensional concept through different quality dimensions. The quality dimensions are implemented in STILTool 2, a web application to automate the quality assessment of the annotations. The evaluation is carried out by comparing the quality of semantic annotations with gold standards. The work presented here has been applied to at least three use cases. The results show that our approach can give us hints about the quality issues and how to address them.",,,,"altro ISBN: eBook ISBN 978-3-030-88361-4 - Doi del prodotto contenitore 10.1007/978-3-030-88361-4",,,"Avogadro, R., Cremaschi, M., Jimenez-Ruiz, E., Rula, A. (2021). A Framework for Quality Assessment of Semantic Annotations of Tabular Data. In The Semantic Web – ISWC 2021 20th International Semantic Web Conference, ISWC 2021, Virtual Event, October 24–28, 2021, Proceedings (pp.528-545). Springer, Cham [10.1007/978-3-030-88361-4_31].",,,"9783030883607",,,,"Springer, Cham",,,"Hotho, A; Blomqvist, E; Dietze, S; Fokoue, A; Ding, Y; Barnaghi, P; Haller, A; Dragoni, M; Alani, H",,"2021",,"20th International Semantic Web Conference, ISWC 2021 - October 24–28, 2021","20",,"Auckland, New Zealand (Virtual Event)","The Semantic Web – ISWC 2021 20th International Semantic Web Conference, ISWC 2021, Virtual Event, October 24–28, 2021, Proceedings",,,,,,,,"Data quality; Semantic annotations; Semantic table interpretation; Tabular data;",,"paper","contributo",,"Scientifica",,,,,,"2021","A Framework for Quality Assessment of Semantic Annotations of Tabular Data",,,,,,"2025/03/20 03:34:17","2025/02/03 12:01:00","1738580460378","2021","A Framework for Quality Assessment of Semantic Annotations of Tabular Data",,,"1","repository","submittedVersion","10.1007/978-3-030-88361-4_31",,"repository","true","false","https://hdl.handle.net/11379/552416","other-oa","14/02/2026 02:44:28","1771033469001","green",,,,"LECTURE NOTES IN COMPUTER SCIENCE###0302-9743",,"EX||EP||ET","University of Milano-Bicocca||University of Milano-Bicocca||City St Georges, University of London||University of Brescia","Italy||Italy||England||Italy","Roberto||Marco||Ernesto||Anisa","CCE-8853-2022||LPQ-1600-2024||L-6460-2014||ABC-6214-2020","","Avogadro||Cremaschi||Jimenez-Ruiz||Rula","2021","Much information is conveyed within tables, which can be semantically annotated by humans or (semi)automatic approaches. Nevertheless, many applications cannot take full advantage of semantic annotations because of the low quality. A few methodologies exist for the quality assessment of semantic annotation of tabular data, but they do not automatically assess the quality as a multidimensional concept through different quality dimensions. The quality dimensions are implemented in STILTool 2, a web application to automate the quality assessment of the annotations. The evaluation is carried out by comparing the quality of semantic annotations with gold standards. The work presented here has been applied to at least three use cases. The results show that our approach can give us hints about the quality issues and how to address them.","Avogadro, R; Cremaschi, M; Jiménez-Ruiz, E; Rula, A;","WOS.ISTP","Proceedings Paper","paper","Proceedings Paper","10.1007/978-3-030-88361-4_31","1611-3349","WOS:000706991800031","SEMANTIC WEB - ISWC 2021","LECT NOTES COMPUT SC","English",,"528",,"545","12922","A Framework for Quality Assessment of Semantic Annotations of Tabular Data",,"LECTURE NOTES IN COMPUTER SCIENCE###0302-9743","2614||1700","University of Milano - Bicocca||University of Milano - Bicocca||University of Oslo||University of Brescia","60012306||60012306||60010348||60015300","57215967118||56167172000||15136001900||53980361500","Italy||Italy||Norway||Italy","","Roberto||Marco||Ernesto||Anisa","","Avogadro||Cremaschi||Jiménez-Ruiz||Rula","2021","Much information is conveyed within tables, which can be semantically annotated by humans or (semi)automatic approaches. Nevertheless, many applications cannot take full advantage of semantic annotations because of the low quality. A few methodologies exist for the quality assessment of semantic annotation of tabular data, but they do not automatically assess the quality as a multidimensional concept through different quality dimensions. The quality dimensions are implemented in STILTool 2, a web application to automate the quality assessment of the annotations. The evaluation is carried out by comparing the quality of semantic annotations with gold standards. The work presented here has been applied to at least three use cases. The results show that our approach can give us hints about the quality issues and how to address them.","Avogadro R.; Cremaschi M.; Jimenez-Ruiz E.; Rula A.","scopus.publisher.name||scopus.description.abstracteng||scopus.relation.conferencename||scopus.relation.volume","cp","cp",,,"10.1007/978-3-030-88361-4_31","1611-3349","9783030883607","636212457","2-s2.0-85116931093","25674","eng","Springer Science and Business Media Deutschland GmbH",,"2021","20th International Semantic Web Conference, ISWC 2021",,"528",,"545","12922","Data quality; Semantic annotations; Semantic table interpretation; Tabular data;","A Framework for Quality Assessment of Semantic Annotations of Tabular Data","A Framework for Quality Assessment of Semantic Annotations of Tabular Data"
"e39773c6-6325-35a3-e053-3a05fe0aac26","10281/9140",,,"CEUR WORKSHOP PROCEEDINGS::journal39240::600",,,,,,"AREA MIN. 01 - SCIENZE MATEMATICHE E INFORMATICHE||AREA MIN. 01 - SCIENZE MATEMATICHE E INFORMATICHE",,,,"2021-10-12T17:38:26Z",,"2021-10-12T17:38:26Z","2020-11-05","In this paper, we present a novel unsupervised and automatic approach for Semantic Table Interpretation. The technique presented is performed against DBpedia and Wikidata, and it can be easily adapted to any other Knowledge Graph (KG). Moreover, we provide a tool (LamAPI) that allows to efficiently fetch data needed for Semantic Table Interpretation (STI) tasks from the KG dumps.",,,,,,,"Cremaschi, M., Avogadro, R., Barazzetti, A., Chieregato, D. (2020). MantisTable SE: An efficient approach for the semantic table interpretation. In Proceedings of the Semantic Web Challenge on Tabular Data to Knowledge Graph Matching (SemTab 2020) (pp.75-85). CEUR-WS.",,,,,,,"CEUR-WS",,,"Jiménez-Ruiz, E; Hassanzadeh, O; Efthymiou, V; Chen, J; Srinivas, K; Cutrona, V",,"2020",,"2020 Semantic Web Challenge on Tabular Data to Knowledge Graph Matching, SemTab 2020",,,"Athens, Greece - Virtual","Proceedings of the Semantic Web Challenge on Tabular Data to Knowledge Graph Matching (SemTab 2020)",,,,,,,,"DBpedia; Knowledge Graph; Semantic Table Interpretation; Wikidata",,"paper","contributo",,"Scientifica",,,,,,,,,,,,,,"2023/06/02 14:42:18","1685709738093","2020","MantisTable SE: An efficient approach for the semantic table interpretation",,,"1",,,,,,,,,,,,,,,,,,,,,,,,,,,,,,,,,,,,,,,,,,,,,"CEUR WORKSHOP PROCEEDINGS###1613-0073","1700","University of Milan - Bicocca||University of Milan - Bicocca||University of Milan - Bicocca||University of Milan - Bicocca","60012306||60012306||60012306||60012306","56167172000||57215967118||57220955100||57215962976","Italy||Italy||Italy||Italy","","Marco||Roberto||Andrea||David","","Cremaschi||Avogadro||Barazzetti||Chieregato","2020","In this paper, we present a novel unsupervised and automatic approach for Semantic Table Interpretation. The technique presented is performed against DBpedia and Wikidata, and it can be easily adapted to any other Knowledge Graph (KG). Moreover, we provide a tool (LamAPI) that allows to efficiently fetch data needed for Semantic Table Interpretation (STI) tasks from the KG dumps.","Cremaschi M.; Avogadro R.; Barazzetti A.; Chieregato D.",,"cp","cp",,,,,,"633714758","2-s2.0-85097948224","21100218356","eng","CEUR-WS",,"2020","2020 Semantic Web Challenge on Tabular Data to Knowledge Graph Matching, SemTab 2020",,"75",,"85","2775","DBpedia; Knowledge Graph; Semantic Table Interpretation; Wikidata;","MantisTable SE: An efficient approach for the semantic table interpretation","MantisTable SE: An efficient approach for the semantic table interpretation"
"e39773c6-3195-35a3-e053-3a05fe0aac26","10281/9141",,,"PROGRESS IN IS::journal84867::600",,,,,,"AREA MIN. 09 - INGEGNERIA INDUSTRIALE E DELL’INFORMAZIONE||AREA MIN. 01 - SCIENZE MATEMATICHE E INFORMATICHE",,,,"2021-10-12T15:44:38Z",,"2021-10-12T15:44:38Z",,"This chapter discusses the case of ongoing experiences in the field of Service Science. The experiences refer to the Italian SMART project producing a homonymous methodology, briefly described together with a discussion of its application as an instrument for developing and structuring initiatives in Service Science education and in the design of services in funded industrial research projects. The discussion follows a pragmatist perspective, focusing on the enactment of a “funded experience” by scholars, practitioners, and Service Science students.",,,,,,,"Viscusi, G., Cremaschi, M., Batini, C. (2014). Service Science and Scholarship: Experiences from a Pragmatist Perspective. In G. Motta, B. Wu (a cura di), Software Engineering Education for a Global E-Service Economy (pp. 153-162). Cham : Springer [10.1007/978-3-319-04217-6_19].","10.1007/978-3-319-04217-6",,"978-3-319-04216-9",,"CH",,"Springer","Cham",,"Motta, G; Wu, B",,,,,,,,"Software Engineering Education for a Global E-Service Economy",,,,,,,,"Service Science, Scholarship",,"Capitolo o saggio",,,"Scientifica",,,,,,,,,,,,,,"2023/06/02 09:40:01","1685691601961",,,,,"1","repository","submittedVersion","10.1007/978-3-319-04217-6_19",,"repository","true","false","http://infoscience.epfl.ch/record/197979",,"20/01/2026 03:42:42","1768876962139","green",,,,,,,,,,,,,,,,,,,,,,,,,,,,,,,,,,,,,,,,,,,,,,,,,,,,,,,,,,,,,,,,,,,,,
