"e39773c2-efd6-35a3-e053-3a05fe0aac26","10281/9139","Settore INFO-01/A - Informatica::ou59354::600||Settore IINF-05/A - Sistemi di elaborazione delle informazioni::ou59555::600",,,,,,,,"AREA MIN. 01 - SCIENZE MATEMATICHE E INFORMATICHE||AREA MIN. 09 - INGEGNERIA INDUSTRIALE E DELL’INFORMAZIONE||AREA MIN. 01 - SCIENZE MATEMATICHE E INFORMATICHE",,,,"2016-02-11T15:05:23Z",,"2016-02-11T15:05:23Z",,"The Italian Public Administration (PA) consists in a wide set of local authorities (i.e., regions, provinces and municipalities) providing services to citizens, each with its own administrative autonomy. Actually, it often happens that Italian citizens have difficulties in discovering and using services that they need in the course of their lifes. Several Italian initiatives, such as the SMART (Services and Meta-services for smart e-Government) project, aim to simplify the interaction between Italian citizens and the PA trought the definition of value-added services. A value-added service (VAS) guides the citizen in the fruition of all services needed along a life event (e.g., the change of address). In this paper, we present a new version of the Italian Public Administration Service (IPAS) model defined for the description of PA services. We will show how the new model supports the description of concepts that simplifies the definition of VAS. A case study defined in the context of the SMART project will be presented.",,,,,,,"Comerio, M., Castelli, M., Cremaschi, M. (2013). Towards the Definition of Value-added Services for Citizens: a New Model for the Description of Public Administration Services. INTERNATIONAL JOURNAL OF MANAGEMENT AND INFORMATION TECHNOLOGY, 4(1), 166-173.",,,,,,,,,,,,,,,,,,,,,,,,,,"Service models, service descriptions, value-added services, public administration services",,"Articolo in rivista - Articolo scientifico",,"Pubblicato","Scientifica",,,,,,,,,,,,,,"2023/06/02 12:18:39","1685701119983",,,,,"1",,,,,,,,,,,,,,,,,,,,,,,,,,,,,,,,,,,,,,,,,,,,,,,,,,,,,,,,,,,,,,,,,,,,,,,,,,,,,,,,,
"d5c9d847-0731-4672-91a9-cc7bf4f2224c","10281/9139",,,,,,,,"Goal 9: Industry, Innovation, and Infrastructure::29628::600","AREA MIN. 01 - SCIENZE MATEMATICHE E INFORMATICHE||AREA MIN. 01 - SCIENZE MATEMATICHE E INFORMATICHE",,,"2024-02-23","2024-03-12T13:53:37Z","2024-04-11","2024-03-12T13:53:37Z",,"Limited accessibility to language resources and technologies represents a challenge for the analysis, preservation, and documentation of natural languages other than English. Linguistic Linked (Open) Data (LLOD) holds the promise to ease the creation, linking, and reuse of multilingual linguistic data across distributed and heterogeneous resources. However, individual language resources and technologies accommodate or target different linguistic description levels, e.g. morphology, syntax, phonology, and pragmatics. In this comprehensive survey, the state-of-the-art of multilinguality and LLOD is being represented with a particular focus on linguistic description levels, identifying open challenges and gaps as well as proposing an ideal ecosystem for multilingual LLOD across description levels. This survey seeks to contribute an introductory text for newcomers to the field of multilingual LLOD, uncover gaps and challenges to be tackled by the LLOD community in reference to linguistic description levels, and present a solid basis for a future best practice of multilingual LLOD across description levels.",,,,,,,"Gromann, D., Apostol, E., Chiarcos, C., Cremaschi, M., Gracia, J., Gkirtzou, K., et al. (2024). Multilinguality and LLOD: A Survey Across Linguistic Description Levels. SEMANTIC WEB, 15(5), 1915-1958 [10.3233/SW-243591].",,,,,"NL",,"IOS Press",,,,,,,,,,,,,,,,,,,"linguistic description levels; linguistic linked data; Multilinguality; systematic survey;",,"Articolo in rivista - Articolo scientifico",,"Pubblicato","Scientifica",,,,,,"2024","Multilinguality and LLOD: A survey across linguistic description levels","2024/12/22 09:45:47","1734857147101",,,,,"2024/12/22 09:47:27","1734857247600","2024","Multilinguality and LLOD: A survey across linguistic description levels",,,"1","publisher","publishedVersion","10.3233/sw-243591","non è possibile scaricare un formato valido","publisher","true","false","https://doi.org/10.3233/sw-243591","cc-by","12/02/2026 04:14:48","1770866088420","hybrid","https://content.iospress.com:443/download/semantic-web/sw243591?id=semantic-web%2Fsw243591","5","SEMANTIC WEB###1570-0844",,,"EX||EP||ET","University of Vienna||National University of Science & Technology POLITEHNICA Bucharest||University of Cologne||University of Milan||University of Zaragoza||Institute for Language & Speech Processing (ILSP)||Jerusalem Coll Technol||Mykolas Romeris University||University of Malta||KU Leuven||Communaute Universite Grenoble Alpes||Universidade de Coimbra||University of Milan||National University of Science & Technology POLITEHNICA Bucharest||Vytautas Magnus University||Mykolas Romeris University","Austria||Romania||Germany||Italy||Spain||Greece||Israel||Lithuania||Malta||Belgium||France||Portugal||Italy||Romania||Lithuania||Lithuania","Dagmar||Elena-Simona||Christian||Marco||Jorge||Katerina||Chaya||Liudmila||Michael||Ineke||Gilles||Purificacao||Blerina||Ciprian-Octavian||Andrius||Giedre Valunaite","DUC-2615-2022||AAG-9392-2021||FYU-1528-2022||LPQ-1600-2024||O-7122-2019||MJP-2900-2025||JCF-1133-2023||GBD-1441-2022||JKG-7750-2023||DQE-7294-2022||HQZ-7443-2023||DWA-6780-2022||ABF-8205-2020||J-9536-2014||GLR-2640-2022||MAO-5116-2025","Ctr Translat Studies||Comp Sci & Engn Dept||Inst Digital Humanities IDH||Dipartimento Informat Sistemist & Comunicaz||Aragon Inst Engn Res||Inst Language & Speech Proc||Dept Comp Sci||Inst Humanities||Dept Artificial Intelligence||Ctr Computat Linguist||CNRS||Dept Portuguese & Romance Studies||Dipartimento Informat Sistemist & Comunicaz||Comp Sci & Engn Dept||Social Res Ctr||Inst Humanities","Gromann||Apostol||Chiarcos||Cremaschi||Gracia||Gkirtzou||Liebeskind||Mockiene||Rosner||Schuurman||Serasset||Silvano||Spahiu||Truica||Utka||Oleskeviciene","2024","Limited accessibility to language resources and technologies represents a challenge for the analysis, preservation, and documentation of natural languages other than English. Linguistic Linked (Open) Data (LLOD) holds the promise to ease the creation, linking, and reuse of multilingual linguistic data across distributed and heterogeneous resources. However, individual language resources and technologies accommodate or target different linguistic description levels, e.g., morphology, syntax, phonology, and pragmatics. In this comprehensive survey, the state-of-the-art of multilinguality and LLOD is being represented with a particular focus on linguistic description levels, identifying open challenges and gaps as well as proposing an ideal ecosystem for multilingual LLOD across description levels. This survey seeks to contribute an introductory text for newcomers to the field of multilingual LLOD, uncover gaps and challenges to be tackled by the LLOD community in reference to linguistic description levels, and present a solid basis for a future best practice of multilingual LLOD across description levels.","Gromann, D; Apostol, ES; Chiarcos, C; Cremaschi, M; Gracia, J; Gkirtzou, K; Liebeskind, C; Mockiene, L; Rosner, M; Schuurman, I; Sérasset, G; Silvano, P; Spahiu, B; Truica, CO; Utka, A; Oleskeviciene, GV;","WOS.SCI","Article","Articolo in rivista - Articolo scientifico","Article","10.3233/SW-243591","2210-4968","WOS:001358071100015","SEMANTIC WEB","SEMANT WEB","English","2455 TELLER RD, THOUSAND OAKS, CA 91320 USA","1915","5","1958","15","Multilinguality and LLOD: A survey across linguistic description levels","SEMANTIC WEB###1570-0844",,"1710||1706||1705","University of Vienna||National University of Science and Technology Politehnica||University of Cologne||Università degli Studi di Milano||University of Zaragoza||“Athena” Research Center||Jerusalem College of Technology||Mykolas Romeris University||University of Malta||KU Leuven||LIG||University of Porto||Università degli Studi di Milano||National University of Science and Technology Politehnica||Vytautas Magnus University||Mykolas Romeris University","60025988||60003161||60024025||60030318||60016809||60069211||60027414||60061999||60072651||60025063||60104653||60007249||60030318||60003161||60060664||60061999","55844075500||55365937600||22333764800||56167172000||55392626700||26648420600||55761687500||57215660702||13106151500||25652140200||8897914400||55453450500||56454388200||56331462000||26632661300||57194015310","Austria||Romania||Germany||Italy||Spain||Greece||Israel||Lithuania||Malta||Belgium||France||Portugal||Italy||Romania||Lithuania||Lithuania","105999827||112799246||120664780||104532423||100287562||114916586||106308203||104265798||128229654||104532423||112799246||130623304||114916586","Dagmar||Elena-Simona||Christian||Marco||Jorge||Katerina||Chaya||Liudmila||Michael||Ineke||Gilles||Purificação||Blerina||Ciprian-Octavian||Andrius||Giedre Valunaite","Centre for Translation Studies;||Computer Science and Engineering Department;||Institute for Digital Humanities;||Dipartimento di Informatica Sistemistica e Comunicazione;||Aragon Institute of Engineering Research;||Institute for Language and Speech Processing;||Department of Computer Science;||Institute of Humanities;||Department of Artificial Intelligence;||Centre for Computational Linguistics;||University of Grenoble Alpes;CNRS;Grenoble INP;||Department of Portuguese and Romance Studies;||Dipartimento di Informatica Sistemistica e Comunicazione;||Computer Science and Engineering Department;||Institute of Digital Resources and Interdisciplinary Research;||Institute of Humanities;","Gromann||Apostol||Chiarcos||Cremaschi||Gracia||Gkirtzou||Liebeskind||Mockiene||Rosner||Schuurman||Sérasset||Silvano||Spahiu||Truica||Utka||Oleskeviciene","2024","Limited accessibility to language resources and technologies represents a challenge for the analysis, preservation, and documentation of natural languages other than English. Linguistic Linked (Open) Data (LLOD) holds the promise to ease the creation, linking, and reuse of multilingual linguistic data across distributed and heterogeneous resources. However, individual language resources and technologies accommodate or target different linguistic description levels, e.g., morphology, syntax, phonology, and pragmatics. In this comprehensive survey, the state-of-the-art of multilinguality and LLOD is being represented with a particular focus on linguistic description levels, identifying open challenges and gaps as well as proposing an ideal ecosystem for multilingual LLOD across description levels. This survey seeks to contribute an introductory text for newcomers to the field of multilingual LLOD, uncover gaps and challenges to be tackled by the LLOD community in reference to linguistic description levels, and present a solid basis for a future best practice of multilingual LLOD across description levels.","Gromann D.; Apostol E.-S.; Chiarcos C.; Cremaschi M.; Gracia J.; Gkirtzou K.; Liebeskind C.; Mockiene L.; Rosner M.; Schuurman I.; Serasset G.; Silvano P.; Spahiu B.; Truica C.-O.; Utka A.; Oleskeviciene G.V.","scopus.publisher.name||scopus.description.abstracteng||scopus.relation.issue||scopus.relation.volume","ar","ar","501100006021 - Direction Générale de l’Armement; 501100003329 - Ministerio de Economía y Competitividad; 501100011033 - Agencia Estatal de Investigación; 501100008530 - European Regional Development Fund; 501100004895 - European Social Fund Plus; 501100004895 - European Social Fund Plus; 501100000921 - European Cooperation in Science and Technology; 501100000921 - European Cooperation in Science and Technology;","RYC2019-028112-I; PID2020-113903RB-I00; CA18209;","10.3233/SW-243591","2210-4968",,"2031669130","2-s2.0-85190534479","21100269620","eng","IOS Press BV",,,,,,"1",,"1","linguistic description levels; linguistic linked data; Multilinguality; systematic survey;","Multilinguality and LLOD: A survey across linguistic description levels","Multilinguality and LLOD: A survey across linguistic description levels"
"b4663b20-1a8a-49ae-aa04-64e209f0b063","10281/9139",,,,,,,,"Not applicable::31921::600","AREA MIN. 01 - SCIENZE MATEMATICHE E INFORMATICHE",,,,"2024-10-24T16:18:59Z","2024-09-03","2024-10-24T16:18:59Z",,"Recently, there has been an increasing interest in extracting and annotating tables on the Web. This activity allows the transformation of textual data into machine-readable formats to enable the execution of various artificial intelligence tasks, e.g., semantic search and dataset extension. Semantic Table Interpretation (STI) is the process of annotating elements in a table. The paper explores Semantic Table Interpretation, addressing the challenges of Entity Retrieval and Entity Disambiguation in the context of Knowledge Graphs (KGs). It introduces LamAPI, an Information Retrieval system with string/type-based filtering and s-elBat, an Entity Disambiguation technique that combines heuristic and ML-based approaches. By applying the acquired know-how in the field and extracting algorithms, techniques and components from our previous STI approaches and the state of the art, we have created a new platform capable of annotating any tabular data, ensuring a high level of quality.",,,,,,,"Avogadro, R., D'Adda, F., Cremaschi, M. (2024). Feature/vector entity retrieval and disambiguation techniques to create a supervised and unsupervised semantic table interpretation approach. KNOWLEDGE-BASED SYSTEMS, 304(25 November 2024) [10.1016/j.knosys.2024.112447].",,,,,"NL",,"Elsevier B.V.",,,,"112447",,,,,,,,,,,,,,,"Data enrichment; Knowledge base; Knowledge base construction; Knowledge base extension; Knowledge graph; Semantic table interpretation; Semantic web; Table annotation; Tabular data;",,"Articolo in rivista - Articolo scientifico",,"Pubblicato","Scientifica",,,,,,"2024","Feature/vector entity retrieval and disambiguation techniques to create a supervised and unsupervised semantic table interpretation approach","2024/10/25 05:22:37","1729826557687",,,,"2025/03/26 12:39:34","2024/10/25 05:22:37","1729826557658","2024","Feature/vector entity retrieval and disambiguation techniques to create a supervised and unsupervised semantic table interpretation approach",,,"1","publisher","publishedVersion","10.1016/j.knosys.2024.112447",,"publisher","true","false","https://doi.org/10.1016/j.knosys.2024.112447","cc-by","10/02/2026 04:07:30","1770692850967","hybrid",,,"KNOWLEDGE-BASED SYSTEMS###0950-7051",,,"EP","SINTEF||University of Milano-Bicocca||University of Milano-Bicocca","Norway||Italy||Italy","Roberto||Fabio||Marco","CCE-8853-2022||LGU-8484-2024||LPQ-1600-2024","Dept Informat Syst & Commun||Dept Informat Syst & Commun","Avogadro||D'Adda||Cremaschi","2024","Recently, there has been an increasing interest in extracting and annotating tables on the Web. This activity allows the transformation of textual data into machine-readable formats to enable the execution of various artificial intelligence tasks, e.g., semantic search and dataset extension. Semantic Table Interpretation (STI) is the process of annotating elements in a table. The paper explores Semantic Table Interpretation, addressing the challenges of Entity Retrieval and Entity Disambiguation in the context of Knowledge Graphs (KGs). It introduces LamAPI, an Information Retrieval system with string/type-based filtering and s-elBat, an Entity Disambiguation technique that combines heuristic and ML-based approaches. By applying the acquired knowhow in the field and extracting algorithms, techniques and components from our previous STI approaches and the state of the art, we have created a new platform capable of annotating any tabular data, ensuring a high level of quality.","Avogadro, R; D'Adda, F; Cremaschi, M;","WOS.SCI","Article","Articolo in rivista - Articolo scientifico","Article","10.1016/j.knosys.2024.112447","1872-7409","WOS:001314457200001","KNOWLEDGE-BASED SYSTEMS","KNOWL-BASED SYST","English","RADARWEG 29, 1043 NX AMSTERDAM, NETHERLANDS",,,,"304","Feature/vector entity retrieval and disambiguation techniques to create a supervised and unsupervised semantic table interpretation approach","KNOWLEDGE-BASED SYSTEMS###0950-7051",,"1712||1404||1802||1702","SINTEF||Systems and Communication - University of Milano-Bicocca||Systems and Communication - University of Milano-Bicocca","60004205||60012306||60012306","57215967118||58069245800||56167172000","Norway||Italy||Italy","113548862||113548862","Roberto||Fabio||Marco","Department of Informatics;||Department of Informatics;","Avogadro||D'Adda||Cremaschi","2024","Recently, there has been an increasing interest in extracting and annotating tables on the Web. This activity allows the transformation of textual data into machine-readable formats to enable the execution of various artificial intelligence tasks, e.g., semantic search and dataset extension. Semantic Table Interpretation (STI) is the process of annotating elements in a table. The paper explores Semantic Table Interpretation, addressing the challenges of Entity Retrieval and Entity Disambiguation in the context of Knowledge Graphs (KGs). It introduces LamAPI, an Information Retrieval system with string/type-based filtering and s-elBat, an Entity Disambiguation technique that combines heuristic and ML-based approaches. By applying the acquired know-how in the field and extracting algorithms, techniques and components from our previous STI approaches and the state of the art, we have created a new platform capable of annotating any tabular data, ensuring a high level of quality.","Avogadro R.; D'Adda F.; Cremaschi M.",,"ar","ar","501100003407 - Ministero dell’Istruzione, dell’Università e della Ricerca;",,"10.1016/j.knosys.2024.112447",,,"2034504976","2-s2.0-85203535729","24772","eng","Elsevier B.V.","112447",,,,,,,"304","Data enrichment; Knowledge base; Knowledge base construction; Knowledge base extension; Knowledge graph; Semantic table interpretation; Semantic web; Table annotation; Tabular data;","Feature/vector entity retrieval and disambiguation techniques to create a supervised and unsupervised semantic table interpretation approach","Feature/vector entity retrieval and disambiguation techniques to create a supervised and unsupervised semantic table interpretation approach"
"a34c7e8f-7531-4e27-a332-ebde8e0515e5","10281/9140",,,,"LECTURE NOTES IN NETWORKS AND SYSTEMS::journal86508::600",,,"Goal 11: Sustainable cities and communities::29630::600",,"AREA MIN. 01 - SCIENZE MATEMATICHE E INFORMATICHE||AREA MIN. 01 - SCIENZE MATEMATICHE E INFORMATICHE||AREA MIN. 01 - SCIENZE MATEMATICHE E INFORMATICHE",,,,"2024-03-08T16:57:12Z",,"2024-03-08T16:57:12Z",,"Datasets that include alignments between natural language and Knowledge Graphs are fundamental to a wide variety of Natural Language Processing and Generation tasks. Current state-of-the-art aligned datasets, though, are significantly impacted by reduced size and scarcity of covered domains, and their quality is difficult to evaluate. To compensate for these issues, we introduce SEALIon, a tool for extracting RDF triples from natural language textual corpora based on a human-in-the-loop approach. We present our first results of SEALIon’s approach, paving the way for further researches in the field of human-in-the-loop triple extraction.",,,,"Doi 10.1007/978-3-031-47721-8 prodotto contenitore",,,"Amianto Barbato, J., Cremaschi, M., Rula, A., Maurino, A. (2024). Toward a Human-in-the-Loop Approach to Create Training Datasets for RDF Lexicalisation. In Intelligent Systems and Applications
Proceedings of the 2023 Intelligent Systems Conference (IntelliSys) Volume 1 (pp.84-101). Springer Science and Business Media Deutschland GmbH [10.1007/978-3-031-47721-8_6].",,,"9783031477201",,,"Springer Science and Business Media Deutschland GmbH",,,,,,"2023",,"Intelligent Systems Conference, IntelliSys 2023 - 7 September 2023 through 8 September 2023",,,"Amsterdam, The Netherlands","Intelligent Systems and Applications
Proceedings of the 2023 Intelligent Systems Conference (IntelliSys) Volume 1",,,,,,,,"Human-in-the-loop; Natural language generation; Natural language processing; Relation extraction;",,"paper","contributo",,"Scientifica",,,,,,"2024","Toward a Human-in-the-Loop Approach to Create Training Datasets for RDF Lexicalisation","2024/12/22 10:07:49","1734858469426",,,,,"2024/12/22 10:07:49","1734858469407","2024","Toward a Human-in-the-Loop Approach to Create Training Datasets for RDF Lexicalisation",,,"1",,,"10.1007/978-3-031-47721-8_6",,,"false","false",,,"12/02/2026 04:14:56","1770866096500","closed",,,,"LECTURE NOTES IN NETWORKS AND SYSTEMS###2367-3370",,"EV||EP","University of Milano-Bicocca||University of Milano-Bicocca||University of Brescia||University of Milano-Bicocca","Italy||Italy||Italy||Italy","Jessica Amianto||Marco||Anisa||Andrea","IVT-0848-2023||LPQ-1600-2024||ABC-6214-2020||FMK-8474-2022","","Barbato||Cremaschi||Rula||Maurino","2024","Datasets that include alignments between natural language and Knowledge Graphs are fundamental to a wide variety of Natural Language Processing and Generation tasks. Current state-of-the-art aligned datasets, though, are significantly impacted by reduced size and scarcity of covered domains, and their quality is difficult to evaluate. To compensate for these issues, we introduce SEALIon, a tool for extracting RDF triples from natural language textual corpora based on a humanin-the-loop approach. We present our first results of SEALIon's approach, paving the way for further researches in the field of human-in-the-loop triple extraction.","Barbato, JA; Cremaschi, M; Rula, A; Maurino, A;","WOS.ISTP","Proceedings Paper","paper","Proceedings Paper","10.1007/978-3-031-47721-8_6","2367-3389","WOS:001261691200006","INTELLIGENT SYSTEMS AND APPLICATIONS, VOL 1, INTELLISYS 2023","LECT NOTE NETW SYST","English",,"84",,"101","822","Toward a Human-in-the-Loop Approach to Create Training Datasets for RDF Lexicalisation",,"LECTURE NOTES IN NETWORKS AND SYSTEMS###2367-3370","2207||1711||1705","University of Milano-Bicocca||University of Milano-Bicocca||University of Brescia||University of Milano-Bicocca","60012306||60012306||60015300||60012306","58193325900||56167172000||53980361500||22433645700","Italy||Italy||Italy||Italy","","Jessica Amianto||Marco||Anisa||Andrea","","Barbato||Cremaschi||Rula||Maurino","2024","Datasets that include alignments between natural language and Knowledge Graphs are fundamental to a wide variety of Natural Language Processing and Generation tasks. Current state-of-the-art aligned datasets, though, are significantly impacted by reduced size and scarcity of covered domains, and their quality is difficult to evaluate. To compensate for these issues, we introduce SEALIon, a tool for extracting RDF triples from natural language textual corpora based on a human-in-the-loop approach. We present our first results of SEALIon’s approach, paving the way for further researches in the field of human-in-the-loop triple extraction.","Barbato J.A.; Cremaschi M.; Rula A.; Maurino A.","scopus.description.allpeopleoriginal||scopus.relation.conferencename||scopus.relation.conferenceplace","cp","cp",,,"10.1007/978-3-031-47721-8_6","2367-3389","9783031477201","643245296","2-s2.0-85182517925","21100901469","eng","Springer Science and Business Media Deutschland GmbH",,"2023","Intelligent Systems Conference, IntelliSys 2023","nld","84",,"101","822","Human-in-the-loop; Natural language generation; Natural language processing; Relation extraction;","Toward a Human-in-the-Loop Approach to Create Training Datasets for RDF Lexicalisation","Toward a Human-in-the-Loop Approach to Create Training Datasets for RDF Lexicalisation"
