"e39773c3-8b18-35a3-e053-3a05fe0aac26","10281/9140",,,"PROCEEDINGS - INTERNATIONAL WORKSHOP ON DATABASE AND EXPERT SYSTEMS APPLICATIONS::journal45251::600",,,,,,"AREA MIN. 09 - INGEGNERIA INDUSTRIALE E DELL’INFORMAZIONE||AREA MIN. 01 - SCIENZE MATEMATICHE E INFORMATICHE||AREA MIN. 01 - SCIENZE MATEMATICHE E INFORMATICHE",,,,"2013-12-18T10:26:34Z",,"2013-12-18T10:26:34Z",,"He Italian Public Administration Services (IPAS) is a registry of services provided to Italian citizens likewise the Local Government Service List (UK), or the European Service List for local authorities from other nations. Unlike existing registries, IPAS presents the novelty of modelling public services from the view point of the value they have for the consumers and the providers. A value-added-service (VAS) is linked to a life event that requires its fruition, addresses consumer categories to identify market opportunities for private providers, and is described by non-functional-properties such as price and time of fruition. Where Italian local authorities leave the citizen-users in a daedal us of references to understand whether they can/have to apply for a service, the IPAS model captures the necessary back-ground knowledge about the connection between administrative legislation and service specifications, life events, and application contexts to support the citizen-users to fulfill their needs. As a proof of concept, we developed an operational web environment named ASSO, designed to assist the citizen-user to intuitively create bundles of mandatory-by-legislation and recommended services, to accomplish his bureaucratic fulfillments. Although ASSO is an ongoing project, domain experts gave preliminary positive feedback on the innovativeness and effectiveness of the proposed approach. © 2013 IEEE.",,,,,,,"Baldassarre, C., Cremaschi, M., Palmonari, M. (2013). Bridging the Gap between Citizens and Local Administrations with Knowledge-Based Service Bundle Recommendations. In Proceedings - International Workshop on Database and Expert Systems Applications, DEXA
2013 (pp.157-161). IEEE [10.1109/DEXA.2013.25].",,"9780769550701",,,,,"IEEE",,,,"6621364","2013",,"International Workshop on Database and Expert Systems Applications (DEXA) 26 August 2013 through 29 August 2013","24th",,"Prague; Czech Republic","Proceedings - International Workshop on Database and Expert Systems Applications, DEXA
2013",,,,,,,,"Italian Government; Public Administration; Reccommender System; Service Catalog; Value Added Services",,"paper","contributo",,"Scientifica",,,,,,"2013","Bridging the gap between citizens and local administrations with knowledge-based service bundle recommendations",,,,,,,"2023/06/02 08:38:06","1685687886491","2013","Bridging the gap between citizens and local administrations with knowledge-based service bundle recommendations",,,"1",,,"10.1109/dexa.2013.25",,,"false",,,,"30/01/2026 03:34:02","1769740442660","closed",,,,"PROCEEDINGS - INTERNATIONAL WORKSHOP ON DATABASE AND EXPERT SYSTEMS APPLICATIONS###1529-4188",,"EX||IQ||ET","University of Milano-Bicocca||University of Milano-Bicocca||University of Milano-Bicocca","Italy||Italy||Italy","Caludio||Marco||Matteo","CEZ-6589-2022||LPQ-1600-2024||AAI-4804-2021","Dept Informat Syst & Commun DISCo||Dept Informat Syst & Commun DISCo||Dept Informat Syst & Commun DISCo","Baldassarre||Cremaschi||Palmonari","2013","The Italian Public Administration Services (IPAS) is a registry of services provided to Italian citizens likewise the Local Government Service List (UK), or the European Service List for local authorities from other nations. Unlike existing registries, IPAS presents the novelty of modelling public services from the view point of the value they have for the consumers and the providers. A value-added-service (VAS) is linked to a life event that requires its fruition, addresses consumer categories to identify market opportunities for private providers, and is described by non-functional-properties such as price and time of fruition. Where Italian local authorities leave the citizen-users in a daedalus of references to understand whether they can/have to apply for a service, the IPAS model captures the necessary background knowledge about the connection between administrative legislation and service specifications, life events, and application contexts to support the citizen-users to fulfill their needs. As a proof of concept, we developed an operational web environment named ASSO, designed to assist the citizen-user to intuitively create bundles of mandatory-by-legislation and recommended services, to accomplish his bureaucratic fulfillments. Although ASSO is an ongoing project, domain experts gave preliminary positive feedback on the innovativeness and effectiveness of the proposed approach.","Baldassarre, C; Cremaschi, M; Palmonari, M;","WOS.ISTP","Proceedings Paper","paper","Proceedings Paper","10.1109/DEXA.2013.25",,"WOS:000335791800029","2013 24TH INTERNATIONAL WORKSHOP ON DATABASE AND EXPERT SYSTEMS APPLICATIONS (DEXA 2013)","INT WORKSHOP DATABAS","English",,"157",,"161",,"Bridging the gap between citizens and local administrations with knowledge-based service bundle recommendations",,"PROCEEDINGS - INTERNATIONAL WORKSHOP ON DATABASE AND EXPERT SYSTEMS APPLICATIONS###1529-4188","2200","University of Milano-Bicocca||University of Milano-Bicocca||University of Milano-Bicocca","60012306||60012306||60012306","36715883300||56167172000||8835755600","Italy||Italy||Italy","103649213||103649213||103649213","Claudio||Marco||Matteo","Department of Informatics, Systems and Communication (DISCo);||Department of Informatics, Systems and Communication (DISCo);||Department of Informatics, Systems and Communication (DISCo);","Baldassarre||Cremaschi||Palmonari","2013","He Italian Public Administration Services (IPAS) is a registry of services provided to Italian citizens likewise the Local Government Service List (UK), or the European Service List for local authorities from other nations. Unlike existing registries, IPAS presents the novelty of modelling public services from the view point of the value they have for the consumers and the providers. A value-added-service (VAS) is linked to a life event that requires its fruition, addresses consumer categories to identify market opportunities for private providers, and is described by non-functional-properties such as price and time of fruition. Where Italian local authorities leave the citizen-users in a daedal us of references to understand whether they can/have to apply for a service, the IPAS model captures the necessary back-ground knowledge about the connection between administrative legislation and service specifications, life events, and application contexts to support the citizen-users to fulfill their needs. As a proof of concept, we developed an operational web environment named ASSO, designed to assist the citizen-user to intuitively create bundles of mandatory-by-legislation and recommended services, to accomplish his bureaucratic fulfillments. Although ASSO is an ongoing project, domain experts gave preliminary positive feedback on the innovativeness and effectiveness of the proposed approach. © 2013 IEEE.","Baldassarre C.; Cremaschi M.; Palmonari M.","scopus.description.allpeopleoriginal||scopus.relation.conferencename||scopus.relation.conferenceplace","cp","cp",,,"10.1109/DEXA.2013.25",,"9780769550701","370290887","2-s2.0-84887875143","4900153216","eng",,"6621364","2013","24th International Workshop on Database and Expert Systems Applications, DEXA 2013","Prague, cze","157",,"161",,"Italian Government; Public Administration; Reccommender System; Service Catalog; Value Added Services;","Bridging the gap between citizens and local administrations with knowledge-based service bundle recommendations","Bridging the gap between citizens and local administrations with knowledge-based service bundle recommendations"
"e39773c4-f6ee-35a3-e053-3a05fe0aac26","10281/9140",,,"LECTURE NOTES IN COMPUTER SCIENCE::journal40095::600",,,,,,"AREA MIN. 01 - SCIENZE MATEMATICHE E INFORMATICHE||AREA MIN. 01 - SCIENZE MATEMATICHE E INFORMATICHE",,,,"2015-12-21T16:35:22Z",,"2015-12-21T16:35:22Z",,"DaCENA (Data Context for News Articles) is a web application that showcases a new approach to reading online news articles with the support of a data context built from interlinked facts available on the Web of Data. Given a source article, a set of facts that are estimated to be more interesting for the readers are extracted from the Web and presented using tailored information visualization methods and an interactive user interface. By looking at this background factual knowledge, the reader is supported in the interpretation of the news content and is suggested connections to related topics that he/she can further explore.",,,,,,"Palmonari, M., Uboldi, G., Cremaschi, M., Ciminieri, D., Bianchi, F. (2015). DaCENA: Serendipitous news reading with data contexts. In Revised Selected Papers - The Semantic Web: ESWC 2015 Satellite Events. Portoroz, Slovenia, May 31-June 4, 2015. (pp.133-137). Springer Verlag [10.1007/978-3-319-25639-9_26].",,,"9783319256382",,,"CH",,"Springer Verlag",,,"Gandon, F; Guéret, C; Villata, S; Breslin, J; Faron-Zucker, C; Zimmermann, A",,"2015",,"European Conference on Semantic Web, ESWC 2015 31 May - 4 June",,,"Portoroz; Slovenia","Revised Selected Papers - The Semantic Web: ESWC 2015 Satellite Events. Portoroz, Slovenia, May 31-June 4, 2015.",,,,,,,,"data journalism, semantic web, data exploration, linked data",,"paper","contributo",,"Scientifica",,,,,,"2015","DaCENA: Serendipitous News Reading with Data Contexts",,,,,,"2025/07/02 06:20:13","2025/07/01 11:43:52","1751363032118","2015","DaCENA: Serendipitous news reading with data contexts",,,"1","publisher","publishedVersion","10.1007/978-3-319-25639-9_26",,"publisher","true","false","https://doi.org/10.1007/978-3-319-25639-9_26","cc-by-nc","24/01/2026 03:52:02","1769223122385","hybrid","https://link.springer.com/content/pdf/10.1007/978-3-319-25639-9_26.pdf",,,"LECTURE NOTES IN COMPUTER SCIENCE###0302-9743",,"RB||EV||EX||EP||ET","University of Milano-Bicocca||Polytechnic University of Milan||University of Milano-Bicocca||Polytechnic University of Milan||University of Milano-Bicocca","Italy||Italy||Italy||Italy||Italy","Matteo||Giorgio||Marco||Daniele||Federico","AAI-4804-2021||EDA-6979-2022||LPQ-1600-2024||CLB-5384-2022||JZT-6891-2024","","Palmonari||Uboldi||Cremaschi||Ciminieri||Bianchi","2015","DaCENA (Data Context for News Articles) is a web application that showcases a new approach to reading online news articles with the support of a data context built from interlinked facts available on the Web of Data. Given a source article, a set of facts that are estimated to be more interesting for the readers are extracted from the Web and presented using tailored information visualization methods and an interactive user interface. By looking at this background factual knowledge, the reader is supported in the interpretation of the news content and is suggested connections to related topics that he/she can further explore.","Palmonari, M; Uboldi, G; Cremaschi, M; Ciminieri, D; Bianchi, F;","WOS.ISTP","Proceedings Paper","paper","Proceedings Paper","10.1007/978-3-319-25639-9_26",,"WOS:000374570000026","SEMANTIC WEB: ESWC 2015 SATELLITE EVENTS","LECT NOTES COMPUT SC","English",,"133",,"137","9341","DaCENA: Serendipitous News Reading with Data Contexts",,"LECTURE NOTES IN COMPUTER SCIENCE###0302-9743","2614||1700","Università degli Studi di Milano-Bicocca||Politecnico di Milano||Università degli Studi di Milano-Bicocca||Politecnico di Milano||Università degli Studi di Milano-Bicocca","60012306||60023256||60012306||60023256||60012306","8835755600||55901108200||56167172000||55497339300||57031310100","Italy||Italy||Italy||Italy||Italy","","Matteo||Giorgio||Marco||Daniele||Federico","","Palmonari||Uboldi||Cremaschi||Ciminieri||Bianchi","2015","DaCENA (Data Context for News Articles) is a web application that showcases a new approach to reading online news articles with the support of a data context built from interlinked facts available on the Web of Data. Given a source article, a set of facts that are estimated to be more interesting for the readers are extracted from the Web and presented using tailored information visualization methods and an interactive user interface. By looking at this background factual knowledge, the reader is supported in the interpretation of the news content and is suggested connections to related topics that he/she can further explore.","Palmonari M.; Uboldi G.; Cremaschi M.; Ciminieri D.; Bianchi F.","scopus.description.allpeopleoriginal||scopus.relation.conferencename||scopus.relation.conferenceplace","cp","cp",,,"10.1007/978-3-319-25639-9_26","1611-3349","9783319256382","607487062","2-s2.0-84952653351","25674","eng","Springer Verlag",,"2015","European Conference on Semantic Web, ESWC 2015","svn","133",,"137","9341",,"DaCENA: Serendipitous news reading with data contexts","DaCENA: Serendipitous news reading with data contexts"
"3791c641-306e-409f-9b0a-dbd0e7e8015b","10281/9140",,,,,,,,"Not applicable::31921::600","AREA MIN. 01 - SCIENZE MATEMATICHE E INFORMATICHE||AREA MIN. 01 - SCIENZE MATEMATICHE E INFORMATICHE",,,,"2025-06-26T06:16:53Z",,"2025-06-26T06:16:53Z",,"A considerable amount of data, presented in a structured form, is available on the Web nowadays. For the informational content of such data to be made accessible and understandable to users, its translation into text is preferable. This task is named 'data-to-text generation' in the state-of-the-art, and it is an instance of the Natural Language Generation. In order to generate some valuable text from data, also known as lexicalisation, some approaches have begun to consider the Resource Description Format (RDF) data present within the Knowledge Graphs. In this context, it is possible to identify two main categories of lexicalisation approaches that use neural networks: pipeline and end-to-end. The former has better performances but is more complex to adapt. The latter, the end-to-end systems, has much simpler architectures but is less precise. In this work, in order to get the best from the two categories, we propose a new hybrid approach, TripleEnc, which, thanks to the concept of vector similarity between RDF triples, identifies the best approach for lexicalisation. Empirical comparisons demonstrate that the novel approach improves the quality of the generated text.",,,,,,,"Cremaschi, M., Saleri, S., Maurino, A. (2022). A geometrical deep learning model for the lexicalisation of 'unseen' RDF triples. In 2021 IEEE 23rd Int Conf on High Performance Computing & Communications; 7th Int Conf on Data Science & Systems; 19th Int Conf on Smart City; 7th Int Conf on Dependability in Sensor, Cloud & Big Data Systems & Application (HPCC/DSS/SmartCity/DependSys) (pp.2233-2240). Institute of Electrical and Electronics Engineers Inc. [10.1109/HPCC-DSS-SmartCity-DependSys53884.2021.00334].",,,"9781665494571",,,,"Institute of Electrical and Electronics Engineers Inc.",,,,,"2021",,"23rd IEEE International Conference on High Performance Computing and Communications, 7th IEEE International Conference on Data Science and Systems, 19th IEEE International Conference on Smart City and 7th IEEE International Conference on Dependability in Sensor, Cloud and Big Data Systems and Applications, HPCC-DSS-SmartCity-DependSys 2021 - 20-22 December 2021",,,"Haikou, Hainan, China","2021 IEEE 23rd Int Conf on High Performance Computing & Communications; 7th Int Conf on Data Science & Systems; 19th Int Conf on Smart City; 7th Int Conf on Dependability in Sensor, Cloud & Big Data Systems & Application (HPCC/DSS/SmartCity/DependSys)",,,,,,,,"Lexicalisation; Natural Language Generation; RDF triples;",,"paper","contributo",,"Scientifica",,,,,,,,,,,,,"2025/06/27 03:26:49","2025/06/26 08:16:53","1750918613847","2022","A geometrical deep learning model for the lexicalisation of 'unseen' RDF triples",,,"1",,,"10.1109/hpcc-dss-smartcity-dependsys53884.2021.00334",,,"false",,,,"29/01/2026 04:08:14","1769656094207","closed",,,,,,,,,,,,,,,,,,,,,,,,,,,,,,,,,,"1710||3105||2213||2102||1706||1705||1802||1702","Department of Computer Science Systems and Communication||Department of Computer Science Systems and Communication||Department of Computer Science Systems and Communication","60012306||60012306||60012306","56167172000||57754637100||22433645700","Italy||Italy||Italy","103648872||103648872||103648872","Marco||Simone||Andrea","University of Milano - Bicocca;||University of Milano - Bicocca;||University of Milano - Bicocca;","Cremaschi||Saleri||Maurino","2022","A considerable amount of data, presented in a structured form, is available on the Web nowadays. For the informational content of such data to be made accessible and understandable to users, its translation into text is preferable. This task is named 'data-to-text generation' in the state-of-the-art, and it is an instance of the Natural Language Generation. In order to generate some valuable text from data, also known as lexicalisation, some approaches have begun to consider the Resource Description Format (RDF) data present within the Knowledge Graphs. In this context, it is possible to identify two main categories of lexicalisation approaches that use neural networks: pipeline and end-to-end. The former has better performances but is more complex to adapt. The latter, the end-to-end systems, has much simpler architectures but is less precise. In this work, in order to get the best from the two categories, we propose a new hybrid approach, TripleEnc, which, thanks to the concept of vector similarity between RDF triples, identifies the best approach for lexicalisation. Empirical comparisons demonstrate that the novel approach improves the quality of the generated text.","Cremaschi M.; Saleri S.; Maurino A.","scopus.relation.conferencename||scopus.relation.conferenceplace","cp","cp",,,"10.1109/HPCC-DSS-SmartCity-DependSys53884.2021.00334",,"9781665494571","638290539","2-s2.0-85132389871","21101093009","eng","Institute of Electrical and Electronics Engineers Inc.",,"2021","23rd IEEE International Conference on High Performance Computing and Communications, 7th IEEE International Conference on Data Science and Systems, 19th IEEE International Conference on Smart City and 7th IEEE International Conference on Dependability in Sensor, Cloud and Big Data Systems and Applications, HPCC-DSS-SmartCity-DependSys 2021","chn","2233",,"2240",,"Lexicalisation; Natural Language Generation; RDF triples;","A geometrical deep learning model for the lexicalisation of 'unseen' RDF triples","A geometrical deep learning model for the lexicalisation of 'unseen' RDF triples"
"e5102221-4fbd-44e1-a316-ba46598fcc6c","10281/9140","Settore INFO-01/A - Informatica::ou59354::600",,,"CEUR WORKSHOP PROCEEDINGS::journal39240::600",,,,"Not applicable::31921::600","AREA MIN. 01 - SCIENZE MATEMATICHE E INFORMATICHE||AREA MIN. 01 - SCIENZE MATEMATICHE E INFORMATICHE||AREA MIN. 01 - SCIENZE MATEMATICHE E INFORMATICHE||AREA MIN. 01 - SCIENZE MATEMATICHE E INFORMATICHE",,,,"2024-02-27T08:40:52Z",,"2024-02-27T08:40:52Z","2023-11-06","In the video game industry, great importance is given to the experience that the user has while playing a game. In particular, this experience benefits from the players' perceived sense of being in the game or immersion. The level of user immersion depends not only on the game's content but also on how the game is displayed, thus on its User Interface (UI ) and the Head’s-Up Display (HUD). Another factor influencing immersiveness that has been found in the literature is the player's expertise: the more experience the user has with a specific game, the less they need information on the screen to be immersed in the game.
Player's level of immersion can be accessed by using both questionnaires of their perceived experience and exploiting their behavioural and physiological responses while playing the target game.
Therefore, in this paper, we propose an experimental protocol to access immersiveness of gamers while playing a third-person shooter (Fortnite) with UIs with a standard, a dietetic, and a proposed HUD. A subjective evaluation of the immersion will be provided by completing the Immersive Experience Questionnaire (IEQ), while objective indicators will be provided by face tracking, behaviour and physiological responses analyses.
The ultimate goal of this study is to define guidelines for video game UI development that can enhance the players' immersion.",,,,"https://doi.org/10.48550/arXiv.2310.16431","Silvia Corchs, Simone Fontana, Aurora Saibene, Jordi Solé-Casals",,"Malaspina, M., Amianto Barbato, J., Cremaschi, M., Gasparini, F., Grossi, A., Saibene, A. (2023). An experimental protocol to access immersiveness in video games. In Proceedings of the 2nd Workshop on Artificial Intelligence for Human-Machine Interaction 2023 co-located with the 22nd International Conference of the Italian Association for Artificial Intelligence (AIxIA 2023) (pp.69-81). CEUR-WS.",,,,,,,"CEUR-WS",,,"Saibene, A; Corchs, S; Fontana, S; Solé-Casals, J",,"2023",,"2nd Workshop on Artificial Intelligence for Human-Machine Interaction, AIxHMI 2023 - 6 November 2023","2",,"Rome, Italy","Proceedings of the 2nd Workshop on Artificial Intelligence for Human-Machine Interaction 2023 co-located with the 22nd International Conference of the Italian Association for Artificial Intelligence (AIxIA 2023)",,,,,,,,"Affective gaming; Fortnite; Head’s-Up Displays; Immersiveness; PlayStation; Third-person shooter;",,"paper","contributo",,"Scientifica",,,,,,,,,,,,,"2025/03/25 03:36:27","2024/12/16 08:29:08","1734334148357","2023","An experimental protocol to access immersiveness in video games","2024/03/05 09:31:00","1709627460176","1",,,,,,,,,,,,,,,,,,,,,,,,,,,,,,,,,,,,,,,,,,,,,"CEUR WORKSHOP PROCEEDINGS###1613-0073","1700","University of Milano-Bicocca||University of Milano-Bicocca||University of Milano-Bicocca||Milan Center for Neuroscience||Milan Center for Neuroscience||Milan Center for Neuroscience","60012306||60012306||60012306||60012306||60012306||60012306","58689407700||58193325900||56167172000||7006683862||57221994501||57204909316","Italy||Italy||Italy||Italy||Italy||Italy","","Marika||Jessica Amianto||Marco||Francesca||Alessandra||Aurora","NeuroMI;||NeuroMI;||NeuroMI;","Malaspina||Barbato||Cremaschi||Gasparini||Grossi||Saibene","2023","In the video game industry, great importance is given to the experience that the user has while playing a game. In particular, this experience benefits from the players’ perceived sense of being in the game or immersion. The level of user immersion depends not only on the game’s content but also on how the game is displayed, thus on its User Interface (UI) and the Head’s-Up Display (HUD). Another factor influencing immersiveness that has been found in the literature is the player’s expertise: the more experience the user has with a specific game, the less they need information on the screen to be immersed in the game. Player’s level of immersion can be accessed by using both questionnaires of their perceived experience and exploiting their behavioural and physiological responses while playing the target game. Therefore, in this paper, we propose an experimental protocol to access immersiveness of gamers while playing a third-person shooter (Fortnite) with UIs with a standard, a dietetic, and a proposed HUD. A subjective evaluation of the immersion will be provided by completing the Immersive Experience Questionnaire (IEQ), while objective indicators will be provided by face tracking, behaviour and physiological responses analyses. The ultimate goal of this study is to define guidelines for video game UI development that can enhance the players’ immersion.","Malaspina M.; Barbato J.A.; Cremaschi M.; Gasparini F.; Grossi A.; Saibene A.","scopus.relation.conferencename||scopus.description.allpeopleoriginal||scopus.description.abstracteng||scopus.relation.conferenceplace","cp","cp",,,,,,"642980946","2-s2.0-85179581581","21100218356","eng","CEUR-WS",,"2023","2nd Workshop on Artificial Intelligence for Human-Machine Interaction, AIxHMI 2023","ita","69",,"81","3576","Affective gaming; Fortnite; Head’s-Up Displays; Immersiveness; PlayStation; Third-person shooter;","An experimental protocol to access immersiveness in video games","An experimental protocol to access immersiveness in video games"
